{
  "$schema": "https://json-schema.org/draft/2020-12/schema",
  "$id": "https://securelocaldocqa.local/schemas/chunk/1.0.0",
  "title": "Chunk",
  "description": "One retrievable unit of a document. Fields follow SDD 5.1 'Chunk', extended with page_spans because a chunk is not confined to a single page.",
  "type": "object",
  "required": [
    "schema_version", "chunk_id", "document_id", "ordinal", "text",
    "text_checksum_sha256", "char_start", "char_end", "page_start", "page_end",
    "page_spans", "token_estimate", "chunker_config_id", "chunker_version"
  ],
  "additionalProperties": false,
  "properties": {
    "schema_version": { "const": "1.0.0" },
    "chunk_id": {
      "type": "string",
      "pattern": "^chk_[0-9a-f]{24}$",
      "description": "sha256(document_id|chunker_config_id|char_start|char_end). Deterministic: the same file and config reproduce this exactly, so citations survive reindexing."
    },
    "document_id": { "type": "string", "pattern": "^doc_[0-9a-f]{24}$" },
    "ordinal": {
      "type": "integer", "minimum": 0,
      "description": "Order within the document, 0-based. Presentation only; never an identity component."
    },
    "text": { "type": "string", "minLength": 1 },
    "text_checksum_sha256": {
      "type": "string", "pattern": "^[0-9a-f]{64}$",
      "description": "Integrity check at index time. A chunk whose text no longer hashes to this was corrupted in transit or storage."
    },
    "char_start": {
      "type": "integer", "minimum": 0,
      "description": "Offset into the document's canonical text stream, not into any single page."
    },
    "char_end": { "type": "integer", "minimum": 1 },
    "page_start": { "type": "integer", "minimum": 1, "description": "1-based, inclusive, as a reader would cite it." },
    "page_end": { "type": "integer", "minimum": 1, "description": "1-based, inclusive. Equals page_start only when the chunk fits on one page." },
    "page_spans": {
      "type": "array", "minItems": 1,
      "description": "One entry per page the chunk touches, carrying the coordinates a citation needs to highlight its passage on that page.",
      "items": { "$ref": "#/$defs/page_span" }
    },
    "token_estimate": {
      "type": "integer", "minimum": 1,
      "description": "Heuristic (characters / 4) for E3 context budgeting. Not a tokenizer result; do not use it for anything that must be exact."
    },
    "chunker_config_id": { "type": "string", "pattern": "^cfg_[0-9a-f]{12}$" },
    "chunker_version": { "type": "string" },
    "embedding": {
      "type": ["array", "null"],
      "items": { "type": "number" },
      "description": "Populated by E3, not E2. Absent in ingestion output."
    }
  },
  "$defs": {
    "page_span": {
      "type": "object",
      "required": [
        "page_number", "char_start", "char_end", "page_char_start",
        "page_char_end", "highlight_rects", "coordinates_reliable",
        "page_width", "page_height"
      ],
      "additionalProperties": false,
      "properties": {
        "page_number": { "type": "integer", "minimum": 1 },
        "char_start": { "type": "integer", "minimum": 0, "description": "Offset into the document text stream." },
        "char_end": { "type": "integer", "minimum": 0 },
        "page_char_start": { "type": "integer", "minimum": 0, "description": "Offset within this page's own text, for rendering a single page in isolation." },
        "page_char_end": { "type": "integer", "minimum": 0 },
        "highlight_rects": {
          "type": "array",
          "description": "One rectangle per text line, in PDF points with a top-left origin. Empty when coordinates are unavailable.",
          "items": {
            "type": "array", "minItems": 4, "maxItems": 4,
            "items": { "type": "number" }
          }
        },
        "coordinates_reliable": {
          "type": "boolean",
          "description": "False means cite the page but do not attempt to highlight. SDD 7.3 makes highlighting conditional on reliable coordinates."
        },
        "page_width": { "type": "number", "exclusiveMinimum": 0 },
        "page_height": { "type": "number", "exclusiveMinimum": 0 }
      }
    }
  }
}
